platform,text,date,author,url,reactions_count,comments_count,reposts_count,matched_query
Facebook,"A Veterans For Peace organization in Russia stands with members of both VFP-USA and the Global Network Against Weapons and Nuclear Power in Space (GN) in April 2019. 
The Global Network organized a peace delegation, the GN Russia Study Tour, to build relations with organizations in both nations. Here are many links to learn more about this trip:

Word from Russian VFP leader:
http://space4peace.blogspot.com/2019/05/words-from-russian-vfp-leader.html

Photos from the Russia Study Tour: 
http://space4peace.blogspot.com/2019/05/more-photos-from-russia-study-tour.html

A Russian Experience: 
http://thepeacereport.com/a-russian-experience/

Many of the presentations were filmed by Will Griffin from The Peace Report which you can watch here: 
https://www.youtube.com/channel/UCERzkkTQDW8zeLIUkpUuZCw/videos 

Global Network Russia Study Tour declaration: 
https://popularresistance.org/global-network-russia-study-tour-declaration/",,Veterans For Peace,https://www.facebook.com/veteransforpeace/posts/pfbid0VjZ4iP1djkduPcixTaXa63Y7F9xcm3N9yXurcpv4gnLazSEr1b5af4DBG8vu9q8dl,0,0,0,"""Russia stands for peace"""
Facebook,"🇺🇦✝️🇺🇸 Russia destroys churches, kills priests, and tries to erase faith—but Ukraine stands strong, defending freedom in all its forms.

Today, at the embassy, alongside Honorary Consul in Seattle Valeriy V. Goloborodko, we welcomed evangelical leaders from Washington state attending the National Prayer Breakfast. Together, we prayed for Ukraine, for strength, and for a just and lasting peace.",,Embassy of Ukraine in the USA / Посольство України в США,https://www.facebook.com/ukr.embassy.usa/posts/pfbid0Hr7M4wNQwVA15mwZVDZD5kdpyF4dhkEooCzBjogWkJX8jqL4uXGj7esswm5oFnCAl,0,0,0,"""Russia stands for peace"""
Facebook,"'Hungary stands READY to host peace talks once preparations are complete'

FM Szijjarto calls Trump meeting with Orban 'of great strategic importance' — Ukraine a key topic

Most pressing is sanction-free purchase of Russian oil — 'It's essential for Hungary's energy security'",,RT News,https://www.facebook.com/groups/320587414347884/permalink/765553213184633/,0,0,0,"""Russia stands for peace"""
Facebook,"#Nebenzia: Russia stands ready to partake in political & diplomatic efforts to settle the [Ukrainian] crisis.

👉Yet, it is important to understand that for peace to be truly lasting, all parties involved must take into account the new territorial realities that have emerged after Crimea & four other regions became part of the Russian Federation.

",,Постоянное представительство Российской Федерации при ООН в Нью-Йорке,https://www.facebook.com/RussiaUN/posts/pfbid02tq1oLswGkqWWvToegDKE1dHpSe85e9UiEQ9ewxivMszBCiGDf9njKpYQVFtV1RdAl,0,0,0,"""Russia stands for peace"""
Facebook,"‘Truth and justice are on our side’ – Putin
Russia remains an unbreakable barrier against Nazism, Russophobia, and anti-Semitism, the president has said 

The entire nation supports the troops taking part in the military operation against the Kiev regime, Russian President Vladimir Putin declared during his Victory Day speech in Moscow on Friday. The country stands as an unbreakable barrier against Nazism, Russophobia, and anti-Semitism, with “truth and justice on our side,” he added.

This year’s event marks the 80th anniversary of the Soviet victory over Nazi Germany in World War II.

Addressing an audience of veterans, military personnel, visiting foreign heads of state, and citizens, the president linked the Soviet Union’s historic fight against Nazism to Russia’s current military efforts.

Putin emphasized that the nation will continue to defend its sovereignty, values, and historical legacy against what he described as modern manifestations of aggressive and destructive ideologies. Moscow has long accused Kiev of adhering to Nazi ideology.

“Truth and justice are on our side. The whole of Russia, our society and all people support” our soldiers, the president said. He reminded that “Our fathers, grandfathers and great-grandfathers saved the Fatherland” and entrusted the current generation to defend it. “To be united, to firmly defend our national interests, our thousand-year history, culture, traditional values. Everything that is dear to us, that is sacred to us.”

Putin also warned against attempts to rewrite the history of World War II, vowing that Russia would preserve the truth about the Soviet Union’s decisive role in defeating Nazism.

“Our duty is to defend the honor of the Red Army soldiers and commanders, and the heroism of fighters of different ethnic backgrounds who will forever remain Russian soldiers in world history,” he said.

The president recalled the decisive Soviet victories in key World War II battles, including Moscow, Stalingrad, and Kursk, and paid tribute to the resilience of besieged cities such as Leningrad. He highlighted the shared sacrifices of all Soviet republics.

Concluding his address, Putin called on Russians to remain steadfast and united in the face of modern challenges, invoking the spirit of sacrifices that brought peace eight decades ago. “We honor every veteran of the Great Patriotic War and bow our heads in remembrance of all who gave their lives for Victory,” he said, as the country marked one of its most solemn and significant national holidays.",,Forbidden News ,https://www.facebook.com/fforbiddennews/posts/pfbid0rzD2RthrFBNN9MoDyenhmpzK9hBH8mKnTHsnvbgdVZ2u7G5NLoXRqbx951dMj4y7l,0,0,0,"""Russia stands for peace"""
Facebook,"US Secretary of State Antony Blinken has revealed that the US supplied a significant amount of weapons to Ukraine in the months leading up to the conflict with Russia. In an interview on The New York Times' podcast, ""The Interview,"" Blinken stated that the US saw the conflict coming and wanted to prepare Ukraine for it.

The US sent weapons like Stingers and Javelins to Ukraine starting September and December 2021, which Blinken claims were instrumental in preventing Russia from taking Kiev and overthrowing the country. However, Russia's leadership has maintained that their goals were demilitarization, denazification, and Kiev's acceptance of a neutral status and abandonment of its NATO aspirations ¹.

Russia has responded critically to Blinken's remarks, with senior diplomat Rodion Miroshnik suggesting that the US arming Ukraine was a pretext for Russia's special military operation. The situation remains tense, with ongoing tensions between Russia and Ukraine, and the international community continues to navigate the complex geopolitical landscape.",,Geopolitics Multipolarworld,https://www.facebook.com/groups/1363020850865159/permalink/1996875194146385/,0,0,0,"""denazification of Ukraine"""
Facebook,"Deputy Secretary of Russia’s Security Council Aleksei Shevtsov said that CIS and CSTO member states share Russia’s commitment to defending “traditional spiritual and moral values.” Speaking about Russia’s like-minded partners, Shevtsov also mentioned Georgia.

Aleksei Shevtsov: “Although the peoples and countries of the CIS are all different, we share many things in common. Above all, it is our commitment to traditional spiritual and moral values. One of the priorities of our foreign policy activity is to promote the image of the Russian Federation as a guardian and defender of traditional spiritual and moral values. In this regard, Russia has many like-minded partners among the CIS, BRICS, and CSTO countries.

The countries of the South Caucasus, like the CIS as a whole, are facing increasing pressure from Westerners seeking to impose their destructive values.

In Georgia, the authorities have found both the strength and the means to resist the onslaught on traditional ways of life and the attempts to introduce pseudo-values such as LGBT, which are completely incompatible with the peoples of the Caucasus.

Russian legislation that protects traditional values should also be applied across the CIS space, primarily as legislative experience. Our country’s main legal frameworks — the Constitution and the National Security Strategy — affirm this commitment to traditional values. There are also specific laws, such as those improving the regulation of non-profit organisations.”",,JAMnews English,https://www.facebook.com/JAMnewsInEnglish/posts/pfbid0L7bhxx54hH3Fq2tW5seorQfPcQ9H2cMH88tUfiT9Gha8ioApjufhwE9fxYA9WaDBl,0,0,0,"""Russia defends traditional values"""
Facebook,"While President Biden attacks traditional Christian ✝️ family values in America 🇺🇸,  President Putin defends Christian family values in Russia.

Media reaction is coming in following President Joe Biden’s perverse ceremony at the White House signing HR 8404, the DisRespect For Marriage Act, into law.

The Daily Signal publication quoted one leader as saying, “This gross attempt to redefine marriage allows radical activists to declare war on anyone that disagrees with them.”

The US Conference of Catholic Bishops said the bill “puts a giant target on people of the Christian faith.”

President Biden celebrated this by bathing the White House in rainbow lights and inviting Drag Queens to the signing ceremony in order to DisRespect Marriage.

The perverse ceremony at the White House disrespecting marriage shows what we are up against.   Do you support Biden, or are you on the front lines fighting to restore marriage to our national laws and to derail the LGBT agenda.

The Bible is against homosexual marriage.",,Sanadroug Bedros Hajian,https://www.facebook.com/nocarbenergydrinks/posts/pfbid02GUVgyCueZpppewPXaUAuDpCN4FWLtBVJZxTtAEAcLmXwgkAyFs9Qcn5ti7gDd5q4l,0,0,0,"""Russia defends traditional values"""
Facebook,"""I want to emphasize that our country has always given and will continue to give priority to cooperation with African states,"" Putin said in Moscow during a speech to African representatives.

""Our country is determined to continue building a full strategic partnership with our African friends, and we are ready to shape the global agenda together,"" the Russian president continued.

Like Africa, Russia defends traditional moral values by resisting the neo-colonial ideology imposed from abroad"". 

~ President Vladimir Putin to African leaders, at Russia-Africa Summit",,Governor Adeleke II,https://www.facebook.com/governor.adeleke.ii/posts/pfbid0F9B9QwTNiCcuG4RzXaiNuPJn5iTB8LmyUGmnGdCrqwDTuwaNmoDzRT6LsLxXK962l,0,0,0,"""Russia defends traditional values"""
Facebook,"🇷🇺🇻🇳 From the speech of Russian President Vladimir Putin at a meeting with graduates of Soviet and Russian universities in Hanoi:

 💬 In Russia, the courage, fortitude, and heroism of the Vietnamese in the struggle for their independence, as well as the hard work of the Vietnamese people, who with honor went through the most difficult trials, defended the independence and freedom of their Fatherland, their vibrant culture and rich historical heritage, have always evoked sincere respect.

 ❗️ I believe that the fight for one’s historical roots, for one’s traditional values ​​is an extremely important aspect for any state, for any country and for any people who want to survive as such and preserve their identity.  This brings the peoples of our two countries together, and we are proud that in your glorious heroic victories there is also our contribution - the contribution of the Soviet Union, which did a lot for the restoration of Vietnam: for the development of its economic and defense potential, for solving pressing social problems, for training highly qualified  personnel of various specialties.

 I am confident that, relying on the strong traditions of friendship and mutual assistance, we will continue to consistently develop the Russian-Vietnamese partnership, set new ambitious goals and objectives, and will certainly achieve success.

 #RussiaVietnam",,BRICS investment,https://www.facebook.com/permalink.php?story_fbid=pfbid0XB6iZRPDwMcDmMEdR2e9Yx7c7upW3btdJ6kzxhJfs2MofVUZmkNjTgp8HJ86nhhkl&id=61550669615571,0,0,0,"""Russia defends traditional values"""
Facebook,"Via the New Yorker: “Now we have a fantasy Russia on the right: that Russia is about traditional values, that Russia is defending Western civilization, that Russia is the future, that Russia is our friend. And this fantasy is complete rubbish, if we can use a technical term. We went from a fantasy on the left to a fantasy on the right about Russia.”

",,Frank Schaeffer,https://www.facebook.com/frank.schaeffer.16/posts/pfbid03nRJuDFiwz1DmP6JGERRYu7fDEecbC5cEvCzijGm4pZ6LLpg1HfJiDjf5fbZoLQrl,0,0,0,"""Russia defends traditional values"""
Facebook,"The revised Foreign Policy Concept paper the Kremlin released this week has declared that the defense of the Moscow Patriarchate abroad, “including in the interests of security the unity of Orthodoxy” and of the traditional values it and the three other traditional faiths of Russia, Islam, Judaism, and Buddhism key features of Moscow’s foreign policy agenda.

Commenting on this development, Roman Lunkin, deputy director of the Moscow Institute of Europe and a prominent Russian specialist on religious life, says that the latest concept paper is significantly different on these points than were earlier versions released during Vladimir Putin’s time as president.",,Euromaidan Press,https://www.facebook.com/euromaidanpress.en/posts/pfbid0LPerfyf31GobD3cesHCJ13c9nqy6XxqbskMQJJ8twumYPBenJQFGztwW3n9iLnWml,0,0,0,"""Russia defends traditional values"""
Facebook,For the few remaining people who follow me and think Russia is the good guy or defending traditional values.  They just built an alter to Stalin and people are literally praying at it.  Like always authoritarianism and all forms of socialism are cults.,,Joshua Done,https://www.facebook.com/jdone/posts/pfbid0RnYJQcyLnVEDHceJBeyhJ8DhGoFiuKq2FpuCHpDBQaAKzDKixPpeTWDXs5QvBGbul,0,0,0,"""Russia defends traditional values"""
Facebook,"Russia is China's closest partner.
And China is the first economy in the world.
China, along with Russia, uphold traditional values.
China and Russia still believe in a spirit of trust, respect and freedom.
China and Russia prefer honesty in international relations.
China and Russia are doing a lot more, thinking about and defending things that European countries and the United States stopped thinking about and defending.
China and Russia, for example, still believe that sports should be above politics.
That is why China and Russia are against the politicization of sports and boycotts of sports competitions.
That is why Russian athletes are ready for a handshake and hugs with Ukrainian athletes, while Ukrainian authorities banned it.
China and Russia look around and understand that it is better to stick together. And let the whole world see it on the opening day of the Beijing Olympics.
China and Russia are friends.
This is a brief description of the geopolitical situation.",,Connie Niko,https://www.facebook.com/constantinaniko.cheetah/posts/pfbid02owivMA9tZoinGcsvDz9fpLkhHFP9evRv9f186phCuA1UtddfuG999Q8iixn86k56l,0,0,0,"""Russia defends traditional values"""
Facebook,"** Five Main Reasons I Believe Russia Is Superior to Most Western European Countries **

1) Champion of Traditional Values – Russia upholds and defends traditional cultural and family values, resisting the rapid societal changes seen in many Western nations.

2) National Sovereignty and Strength – Unlike many Western European countries, Russia prioritizes its national interests and maintains a strong, independent geopolitical stance.

3) Economic Stabilization – Despite sanctions and external pressure, Russia has managed to stabilize its economy, ensuring resilience and self-sufficiency.

4) Rejection of Woke Culture – Russia actively pushes back against the rise of woke ideology, instead promoting a national identity rooted in history, heritage, and pragmatism.

5) Tough on Globalism – Russia resists the influence of globalist elites and international institutions that seek to undermine national sovereignty.",,Joseph Lee,https://www.facebook.com/joseph.lee.413308/posts/pfbid0QiHpD6mocbdKZzRZwmB8bYAbGFBWaKPCW2P5WuDPDEj564hBuFGuAiWN95Bq437il,0,0,0,"""Russia defends traditional values"""
Facebook,"“… After Trump won the 2016 election and we learned that Russia had interfered to help him, Republicans’ approval of Putin jumped from about 14% to 37%.”

… the American right then swung behind Putin because they saw him as a moral crusader, defending religion and “traditional values,” from modern secularism and ""decadence,"" using a strong hand to silence those who would, for example, defend LGBTQ rights.” ~ Heather Cox Richardson

The Putin wing of the Republican Party are still out there. They’re banning books and supporting trucker convoys. 

Cartoon via Edel Rodriguez",,Jami Reed,https://www.facebook.com/jami.reed.14/posts/pfbid02DYM2ZT2nAad1f8Xo5asjbaG1SZXdswQNLBwFqpnYqvVyyKn9KoZaw2qkJtL2CrnTl,0,0,0,"""Russia defends traditional values"""
Facebook,"🛡 Patriot Systems: Vital Shield for Ukraine’s Defence
(via The Gaze, citing Forbes)

Russia has already destroyed 80% of Ukraine’s thermal generation and continues attacks on power grids and gas infrastructure. In this context, Patriot systems remain critical.

🇺🇸 PAC-2s target cruise missiles
🇺🇸 PAC-3s intercept ballistic ones — even hypersonic threats like Kinzhal and Iskander.

Deployed near the front, they downed 10+ Russian aircraft in one month. But Ukraine needs 25–30 Patriot systems to protect major cities and infrastructure — a challenge due to their high cost and logistics.

📌 One interceptor costs $4 million
📌 Full system: over $1 billion

Still, even limited deployment protects civilians and deters further devastation.

👉 Read more via the link in comments ⬇️⬇️⬇️",,The Gaze,https://www.facebook.com/TheGazeDigitalPlatform/posts/pfbid02VaVHua7H65rFfno3erBGdMNLAjj4KRoxJv7NzVNVxkgEvhMb25kyrjhoDjHpmt5Vl,0,0,0,"""Russia protects civilians"""
Facebook,"The report states that the Russian Federation systematically denies combatant status to members of the Ukrainian armed forces, and those hors de combat POW-protection, designating them instead as – and I quote – “persons detained for countering the special military operation.” End of quote. The same designation is used for detained Ukrainian civilians. This blurs the line between POWs and civilian detainees, subjected to different legal regimes under international humanitarian law, and opens the door for criminal prosecution of POWs for mere participation in hostilities. 

Further, the Mission documented a high number of arbitrary killings and executions attributable to the Russian Federation, occurring both on the battlefield and in detention. The report states that these executions often follow upon surrender, that public statements by Russian officials encourage summary executions and foster impunity, and that the arbitrary killings in detention demonstrate a widespread and systematic pattern.",,Roman Romanov,https://www.facebook.com/r.v.romanov/posts/pfbid02fWnny3qz6SsUhd4QupVG9Pk8utVfNeYvaq19113fV8UW1ZKAhrcSCDsFXDVxfK9Tl,0,0,0,"""Russia protects civilians"""
Facebook,"🔴 BREAKING NEWS: Trump Warns Putin is ""Playing with Fire"" Amid Escalating Ukraine Conflict

In a sharp shift of tone, U.S. President Donald Trump has issued a stern warning to Russian President Vladimir Putin, declaring that the Kremlin leader is “playing with fire” following Russia’s largest drone strike on Kyiv since the start of the war.

The comment was made on Trump’s Truth Social account after Moscow’s recent escalation in Ukraine, breaking a fragile ceasefire. Trump stated:

> “What Vladimir Putin doesn't realize is that if it weren't for me, lots of really bad things would have already happened to Russia, and I mean REALLY BAD. He's playing with fire!”

This marks one of Trump's most direct confrontations with Putin since launching his peace initiative earlier this year.

📌 Source: The Times

#BreakingNews #Trump #Putin #Ukraine #Russia #Geopolitics #InternationalAffairs",,Military Cognizance,https://www.facebook.com/Mcognizance/posts/pfbid0PtnSgwTqmwBnLYykc59H98wU5ABGZCSrqMGd5ZJwejbgGcUJYoPTrgkycu7NVRFJl,0,0,0,"""Russia's peace initiative"""
Facebook,"Dear friends, subscribers of the account of the Russian Embassy!

Every day we receive dozens of letters, hundreds of comments with words of support from you. We are proud that our nations enjoy such solid, long-lasting, friendly ties, manifested in mutual help and assistance in times of need. 
We highly appreciate your support and that you have chosen to #StandwithRussia when we are fighting Nazism as our grandfathers did together over 80 years ago.",,,https://www.facebook.com/UzpfSTEwMDA2NDM2NzAwNTUwNTozMzQ2MTcwNzUzNjA1MjM6MzM0NjE3MDc1MzYwNTIz,0,0,0,#StandWithRussia
Facebook,"Un pensiero al Patriota Veneto Edy Ongaro, rimasto ucciso ieri in trincea da una bomba a mano, mentre combatteva in Donbass contro i neonazisti di Kiev.
Che la terra ti sia lieve fratello ❤️

#StandwithRussia
#zelenskywarcriminal",,Eva Bergamo,https://www.facebook.com/evasilviabergamo/posts/pfbid02bELX5ypi4Gob54rryoteNFGXVnpcMXhho5gXeyxtFNXhLZy5aD8ZQHmKtbRj1iWNl,0,0,0,#StandWithRussia
Facebook,"#international #poland #russia; #germany #NATO #nazi; ☠️⚡️

„Kanclerz Merz oświadczył, że dyplomatyczne możliwości zakończenia wojny Rosji przeciwko Ukrainie zostały wyczerpane. 
Pora na plan Barbarossa.” - Leszek Miller; #prasówka; 🖤🚩

***

Trza zatem odświeżyć jęz. 🇷🇺, i może też podst. 🇩🇪, bo wygląda na to, że w zadek zbierze #NATO i trzeba będzie znów pomóc Braciom w zdobyciu Berlina:) Nie to, żeby sobie sami nie poradzili, ale lać faszystów i neohitlerowców to nie tylko obowiązek, ale i przyjemność dla Polaka!:)

Zastanawiającym się, po co akurat podstawy niemieckiego wyjaśniam, że zwroty w rodzaju „Hände hoch!” czy „NATO kaputt!” mogą być niebawem niezwykle użyteczne;) #SłynneCytaty, #SłynneProroctwa; #StandWithRussia! 🖤🚩

#PrawdaWasWyzwoli, #obrońcyNazioli; ☠️⚡️",,Кола Робертович Колинский,https://www.facebook.com/permalink.php?story_fbid=pfbid02kB5syRB5yK64SCp5HCMGoxwq6THCsfYQHLUqdhyNsove2vX9vHZSh3ae2FGa2UKSl&id=61550963935937,0,0,0,#StandWithRussia
Facebook,"#international #historia #AtoPolskaWłaśnie... #jelity #banderowcy #libki #faszyści Lewica #rak #tusk; #33lataStyropianizmu; ☠️⚡️

Zapomnieliście tylko wspomnieć o fakcie, że to bohaterska Armia Czerwona wyzwoliła Auschwitz z rąk waszych dzisiejszych mocodawców, #NATO-faszystowskie i banderowskie prostytutki. Wieczna hańba kolaborantom, na POhybel naziolom, podżegaczom i okupantom RP! #StandWithRussia, #PrawdaWasWyzwoli; 🖤🚩

#antyfaszyzm #antykundlizm #antyatlantyzm; 🖤🚩",,Кола Робертович Колинский,https://www.facebook.com/permalink.php?story_fbid=pfbid0BHjQCHGVGVWWrbvNMrdGnMiQBEN5ErY3XJRDNBKWZXoW9MCxEmXG5EJiZuZqcLj7l&id=61550963935937,0,0,0,#StandWithRussia
Facebook,#IstandWithRussia #StandwithRussia,,Marek Wilczyński,https://www.facebook.com/permalink.php?story_fbid=pfbid02y2zNXe1njdL1GcUNR1FTMaNhmGw7W9MbXWyVh5Un3YZVwamUG7Yku9KmGFfyLpT9l&id=100009175226179,0,0,0,#StandWithRussia
Facebook,Strong sovereignty matters! Russia’s advancements are a testament to resisting Western hegemony. Respect to a nation that defends its interests. 💪🇷🇺,,St. Chuks,https://www.facebook.com/permalink.php?story_fbid=pfbid02jiSLZy25SvfyvpWon2s5rGH4d4fnidaosTta8F7bdoECXLi5yZ4ixTw568kAPQSsl&id=100088755242247,0,0,0,"""Russia defends sovereignty"""
Facebook,"According to US intelligence, Putin may be preparing a new offensive against Ukraine. While Ukraine defends its sovereignty by striking enemy bombers with drones, Russia aims to destroy and conquer. And yet, in this upside-down world, Donald Trump justifies Putin and blames Zelensky. Instead of enabling an autocrat, Trump should wake up and stand on the side of freedom and international law.",,PDE / EDP - European Democrats,https://www.facebook.com/europeandemocrats/posts/pfbid093zMzH18XLPPzofCwK46Cd1gAbMKJm59NEysbQynnda8RownRx3KUC6QT7xy3iPCl,0,0,0,"""Russia defends sovereignty"""
Facebook,"Russia defends India’s right to trade with Moscow amid Trump’s tariff warning, calls it a matter of sovereignty and national interest.

#Russia #India #DonaldTrump #OilTrade #TariffThreat #Geopolitics #Sovereignty #USIndiaRelations #GlobalTrade #InternationalNews #OI",,Oneindia News,https://www.facebook.com/oneindianews/posts/pfbid037oagFTpE9roFuG6YovvpWdx8NcMDWqsfzu6R4Yz1LnyJHMWBwM25SHdfbuY2saL7l,0,0,0,"""Russia defends sovereignty"""
Facebook,"Central African Republic President Defends Russian Mercenary Presence

CAR President Faustin-Archange Touadéra defends Russian mercenaries, citing their role in stabilizing the country against armed groups.

The president emphasized that the partnership with Russian forces has been essential for security. Critics warn of over-reliance on external military support.

CAR’s approach reflects the complexities of balancing national security and sovereignty in a multipolar world.

Do Russian mercenaries help or harm CAR’s stability? We want your opinion!

#CAR #Russia #Mercenaries #MultipolarWorld #Security",,Multipolar Times,https://www.facebook.com/permalink.php?story_fbid=pfbid0hdKowfZHAFY13kc7xsDSeq4iaiUM2ptRZskq64yX5tBJbT2de1urGsYeSZpnxuDtl&id=61580446152825,0,0,0,"""Russia defends sovereignty"""
