platform,text,date,author,url,reactions_count,comments_count,reposts_count,matched_query
Facebook,"Please check out this video, on how, from an international relations Marxist perspective, Russia has been as of late - a defender of human rights and people's sovereignty. And that this is something to be commended! 

",,William Morrison,https://www.facebook.com/groups/communistsupporters/permalink/6176317719121256/,0,0,0,"""Russia defends sovereignty"""
Facebook,"UKRAINE WAR || CEASEFIRE OR PEACE AGREEMENT?

The Ukraine war has reached a decisive moment. After years of destruction, loss of lives, and economic collapse, Kyiv stands at a crossroads. The recent meeting between President Putin and President Trump in Alaska has opened a new chapter, pushing the world to ask: what is the best option for Ukraine now?

A full victory on the battlefield looks distant, as Russia continues to hold strong ground. For Ukraine, the more realistic path could be a ceasefire or even a peace agreement that secures its survival, stability, and reconstruction. While hard choices must be made, peace might be the only way forward to prevent further suffering and economic collapse. The global powers are watching, and Ukraine must now decide between endless war or a strategic peace.

#UkraineWar #PeaceTalks #PutinTrump #Geopolitics #WorldAffairs",,Newsaq,https://www.facebook.com/Newsaq/posts/pfbid0cQhnC5BneUxSNYiRFD6zQNyq4ruyEBqZEgPZ6EZqwNkoCz2FSM4mB11QtRoFBmLJl,0,0,0,"""Russia stands for peace and stability"""
Facebook,"India and Japan today signed six agreements in the areas including cyber security, waste water management and clean energy after the 14th India-Japan Annual Summit in New Delhi today. 

Prime Minister Narendra Modi and Japanese Prime Minister Fumio Kishida held productive talks and discussed ways to boost economic and cultural linkages between the two countries. Mr Modi and Mr Kishida also held delegation-level talks. 

They also exchanged views on regional and global issues of mutual interest so as to advance the Partnership for peace, stability and prosperity in the Indo-Pacific region and beyond. India and Japan have multi-faceted cooperation within the ambit of their Special Strategic and Global Partnership. After the annual summit, both the leaders signed a joint statement. 

 In his press statement, Prime Minister Narendra Modi said, today India presents limitless possibilities for Make in India for the world. He said, in this context, Japanese companies have been our brand ambassadors for a long time. 

Mr Modi said, Japan's cooperation in India's flagship projects such as the Dedicated Freight Corridor and the Mumbai-Ahmedabad High Speed Rail has been remarkable. He said, India is grateful to Japan for this contribution. The Prime Minister said, there has been good progress in the Mumbai-Ahmedabad High Speed Rail Project. He said, both India and Japan understand the importance of a secure, trusted, predictable and stable energy supply. Mr Modi said, it is imperative to achieve the goal of sustainable economic growth and tackle the problem of climate change. 

He said, India-Japan Clean Energy Partnership will prove to be a decisive step in this direction. The Prime Minister expressed happiness that Japan will raise its investment target in India to 5 trillion Yen or 3.2 lakh crore rupees over the next five years.
 
He said, the world is still grappling with Covid-19 and its side effects. He said, there are still hurdles in the process of global economic recovery. Mr Modi said, Geo-political events are also presenting new challenges. 
 
In his statement Japanese Prime Minister Fumio Kishida said, the whole world has been shaken today due to many disturbances. He said, it is very important for India and Japan to have a close partnership. Mr Kishida said, both of them expressed their views and talked about the military operation of Russia into Ukraine. The Japanese Prime Minister emphasised on a peaceful solution on the basis of international law.  
 
Mr Modi and Mr Kishida also addressed India-Japan Economic Forum towards realising the unparalleled potential of the economic partnership. Mr Modi spoke about reforms taken by his Government and invited Japanese companies to invest in India. 

The Prime Minister made a commitment to Japanese companies saying that his Government will extend all possible support for their establishment in India. He said, the relationship between the two countries stands on a strong foundation and added that both stand to benefit by it.
       
This is Mr Kishida's first visit to India since he took charge of the office last year. The 14th India Japan Annual Summit is the first meeting of Mr Modi and Mr Kishida.
 
Mr Kishida arrived in New Delhi this afternoon on a two day visit. Union Minister for Railways and IT Ashwini Vaishnaw received the visiting dignitary at the airport.",,All India Radio News,https://www.facebook.com/airnewsalerts/posts/pfbid0WAzvubs83cddN1D5X7TweapSGXZMiCtSuRMXnBuUyiG5foyXUiFmahmBCCEFN16cl,0,0,0,"""Russia stands for peace and stability"""
Facebook,"Iceland has once again secured its place as the most peaceful country in the world, maintaining its reputation for harmony, safety, and stability. Following Iceland are Ireland, New Zealand, Austria, and Switzerland — all recognized for their low conflict and high levels of societal security.

* Meanwhile, Bangladesh ranks 123rd out of 163 countries, highlighting the challenges the nation still faces in terms of security and peace-building efforts.
* In Latin America, Argentina stands at 46th, while Brazil falls much lower at 130th.
* At the bottom of the index is Russia, with the United States ranked 128th.
The Global Peace Index (GPI), published by the Institute for Economics and Peace (IEP), evaluates countries based on:
✔️ Societal safety & security
✔️ Ongoing domestic & international conflicts
✔️ Militarization levels

Fun fact: Beyond being the most peaceful, Iceland is also the 3rd happiest country in the world and one of the Northern Hemisphere’s most desirable travel destinations.",,,https://www.facebook.com/UzpfSTEwMDA2MzYzNjQ4NzE0MjoxMzE3NTQwMDUwMzc3MTk5OjEzMTc1NDAwNTAzNzcxOTk=,0,0,0,"""Russia stands for peace and stability"""
Facebook,"Make Afrika Great: “Russia Putin sent Special VIP Plane to Pick Capt. Ibrahim Traore to Moscow”
—
Captain Ibrahim Traoré’s arrival in Moscow marks more than a diplomatic mission — it symbolizes a powerful shift in Africa’s journey toward sovereignty, unity, and pride. As Burkina Faso stands tall on the world stage, Traoré represents a new wave of African leadership — bold, independent, and deeply rooted in the revolutionary legacy of icons like Thomas Sankara.

This video explores the significance of Traoré’s participation in the 80th Anniversary of Russia's Victory Day, the rising alliance between Africa and Russia, and the awakening of a revolutionary spirit led by Africa’s youth. From the streets of Ouagadougou to the halls of the Kremlin, a new Africa is rising — strong, self-reliant, and unapologetically proud.
—

follow this link to the video: 

👉🏼 https://youtu.be/UFFWedRnzjY

#Russia #IbrahimTraore #Mali #Niger #BurkinaFaso #Sahel #AES #WestAfrica #Africa #Russia #China #Multipolarity #AmericanEmpire #Neocolonialism #USproxyWars #USstateSponsoredTerrorism #USviolationsOfTheUNcharter #USviolationsOfInternationalLaw #USunilateralCoerciveMeasures #UScollectivePunishment #UScrimesAgainstHumanity #GlobalPredatoryCapitalism #CapitalismKills",,Ismaeel Abdur-Rasheed,https://www.facebook.com/groups/767233746760138/permalink/3119144441569045/,0,0,0,"""Russia stands for peace and stability"""
Facebook,"Every Democratic voter we reach now strengthens the foundation we need to win in 2026 and beyond.
ACT NOW !
Help us register more 
new Democrats and 
re-register Democrats, 
plan election day and 
arrange rides. 
Do something to
help your sisters, 
Do something to
help your brothers…
Our future depends on your action on this matter

https://www.usa.gov/change-voter-registration

AND

Vote Democrat! 
we know simple math profits and human rights. 
You will be represented on each law vote on your behalf.
Meanwhile your country 
needs you to work for 
4 upcoming special 
U S Congress elections 
September 9, 2025
   VIRGINIA (D 11)
September 23, 2025 
ARIZONA (D07)
November 4, 2025  
TEXAS (D18)
December 2, 2025 
TENNESSEE (D07)
Volunteer to help these districts win back democracy !
Vote for Democrats
All this year,  2025 !
SAVE your pizza money to DONATE all you can. 
GO online for Contact information volunteer a helping hand in our fight against fascism. 
Call these Democratic Party groups and VOLUNTEER to make PHONE CALLS, write POSTCARDS, from all across the nation. 
SHARE re-post & pin to your Facebook page ! 
Imagine, we could impeach convict arrest & remove the 6pack SCOTUS while Congress expands the SCOTUS to 13 seats, equal to the appellate districts of today. 
Set term limits automatic age limits of 75 years age, enforceable strict ethics including honest audited &  verified financial disclosure. 
A lawful SCOTUS will make our votes count and return human body rights.
Tell friends, family and followers on Facebook and all social medias to work/fight to bare arms with ideals & 
Vote all republicans out !
Criminal puttin invading Ukraine, 
Russia started the war, 
let puttin withdrawal Russian troop forever. 
Same as 45 years of gop 
oligarchy brainwashing, to make you believe corporate oligarchy & CEO’s. 
Again like 1954,
Tax the rich 91% again !
This is it
WeThePeople 
       vs
Oligarchy

Visit our page
David Aiello
Press Follow",,David Aiello,https://www.facebook.com/david.aiello.1447/posts/pfbid02Kuaupfnnz1AKBJkKPtc9tCJaLfH8bVBULu5jsRb82SVKDHwqDBogVX3Hpg9KfxK1l,0,0,0,"""Russia fights for human rights"""
Facebook,"🕯️ Remembering Alexei Navalny: One Year On 🕯️

One year ago, the world lost Alexei Navalny, a courageous voice for democracy, human rights, and the rule of law. His unwavering commitment to justice and his fight against corruption continue to inspire people around the world.

As we reflect on his legacy, we reaffirm the importance of freedom of expression, political pluralism, and the protection of human rights—values that are fundamental to democratic societies.

Germany stands in solidarity with those who advocate for democracy and human rights, in Russia and beyond. Navalny’s vision for a free and just society lives on in those who continue the struggle for a better future.",,German Embassy Cambodia,https://www.facebook.com/germanembassycambodia/posts/pfbid02yBcmmedz5MEvxponG3ALYEjmaHi9zvXqygf22CCjQnuVdKF78Jouu5rkQYAS8kJil,0,0,0,"""Russia fights for human rights"""
Facebook,"Today we march together with #KyivPride 🏳️‍🌈🇺🇦 We march for every member of lgbtq+ community who fights for freedom, for love, for dignity. It is an immense honor to walk with this group and to remind the world of all of those queer Ukrainians who joined the army, who volunteer, who stayed in Ukraine at the risk of being persecuted by Russia. We march today carrying the pictures of brave Ukrainians who fight for our freedom, for basic human rights. And let me tell you it breaks my heart as much as it makes me so fucking PROUD.

Next year, see you at the parade in Kyiv 🌈🌈🌈",,Юлія Зайцева-Кірк,https://www.facebook.com/svulli.ro/posts/pfbid0A2fofTiAMBvf8d8GH9hb6YPDxWRyTJ8ifrPvpsQHZ451U53aWXhrLTm8cs7qC6NKl,0,0,0,"""Russia fights for human rights"""
Facebook,"What does it feel like to fight for human rights? Can the human rights project still be effective in the face of serious contemporary challenges? How can fieldwork successfully promote accountability and remedies for survivors of human rights violations?

This Thursday, Pozen Visiting Professor Julia Hall will look back on her experiences at Amnesty International and Human Rights Watch, analyzing cases where fieldwork and advocacy were successful against the odds. Food will be served to those who register.

Topics covered will include Guantánamo Bay, Hungary's rightward turn, civil society struggles in Türkiye, the Russia/Ukraine War, and the rights of refugees and migrants.

Hall will pay special attention to the personal experiences and perspectives of people involved in human rights struggles, including her own perspective as a lawyer, researcher, and advocate. After her talk, she will be in conversation with Tom Ginsburg, Leo Spitz Distinguished Service Professor of International Law in the Law School and co-chair of the Pozen Center Faculty Board.

Don’t miss this chance to hear about human rights work directly from an experienced practitioner!

Doors open at 4:45 p.m.

Learn more and register: https://humanrights.uchicago.edu/events/close-ground-30-years-human-rights-work-field-halls-power",,Pozen Family Center for Human Rights,https://www.facebook.com/uchicagohumanrights/posts/pfbid02qmskS9kpwe2S14Ym53cvX3z5b1wDUVkVJSAMchgfPt4RdUGe7unfvTFnZzMcNFuYl,0,0,0,"""Russia fights for human rights"""
Facebook,"Westinghouse’s AP300™ Small Modular Reactor (SMR) brings proven nuclear technology to a smaller, flexible scale. Building on the success of its larger sibling, the AP1000®—which is already operating in China and the U.S.—the AP300 SMR is designed for rapid deployment, efficient modular construction, and reliable long-term performance.

Delivering 330 MWe, the AP300 draws from tens of millions of development hours and over 30 years of licensing experience with advanced passive safety systems. Its design emphasizes simplified operations, robust hazard resistance, and a ""fail-safe"" shutdown mechanism that doesn’t rely on operator intervention or backup power.

Importantly, the AP300 is supported by an established supply chain and proven fuel technology with a four-year refueling cycle. It’s suited for communities looking to enhance grid stability alongside renewables, with the added versatility to support district heating, desalination, and hydrogen production.

By basing the AP300 on real-world, operating technology rather than untested designs, Westinghouse offers a lower-risk pathway to cleaner energy and stronger energy security—backed by an expected 80+ year lifespan.",,,https://www.facebook.com/UzpfSTEwMDA2NDQ1Mzc4OTcyMToxMDk4Mzc1NjkyMzIwODgwOjEwOTgzNzU2OTIzMjA4ODA=,0,0,0,"""Russia brings order and safety"""
Facebook,"Putin is defending his nation from the U.S./NATO threat on his border.  

Even President Kennedy was prepared to take the U.S. to war with the USSR because they put nuclear missiles in Cuba.  
The difference is that Krushchev and Kennedy negotiated a solution.  
Kennedy had to remove nukes from Turkey and Krushchev had to remove them from Cuba.  

Biden on the other hand refused to negotiate and in fact sent Boris Johnson and Lloyd Austin to tell Zelensky to walk away from a peace agreement that was ready to be signed.  That was just one month into the limited military operation.

The main problem is that people who watch/read Wall Street neocon media believe that Putin is to blame for everything under the sun while Biden, Zelensky and his Nazis are as innocent as lambs!

I suggest reading/watching independent progressive antiwar experts such as Jacques Baud who worked for NATO and witnessed the aggression of Ukraine against the Ukrainian people who opposed the Biden-engineered 2014 coup that installed Nazi leaders.  Baud witnessed the increasing shelling of innocent people and their children.

The CIA has been working with the Bandera Nazis in Ukraine since 1945 to weaken the USSR and then Russia.  
The color revolutions under Bush and Obama were part of that strategy.  The 2014 color revolution was encouraged by VP Biden and other Americans.  
That led to the coup.

If Russia or China engineered a coup in Canada and put nuclear missiles minutes from Washington DC, OF COURSE the U.S. would invade Canada!",,Marta Neely,https://www.facebook.com/marta.neely/posts/pfbid02ix6f9gbaXiSv38Zty1y6ZFusFpmH2i77kQrJgpvzsZDFmCjgDrPtDqQvf9vFBL6Nl,0,0,0,"""Russia is defending innocent people"""
Facebook,"RUSSIA-UKRAINE WAR: PRESIDENT TRUMP EXPRESSES FRUSTRATION OVER STALLED PEACE PROCESS 

30th March 2025

US  President , Donald Trump has issued stern remarks directed at Russian President Vladimir Putin, vowing additional measures against Russia concerning the ongoing conflict in Ukraine.

 In an interview with NBC News' Kristen Welker, Trump expressed frustration over the lack of progress in negotiations to end the war. He revealed dissatisfaction with Putin's rhetoric about Ukrainian leadership and suggested the possibility of imposing secondary tariffs on Russian oil if Russia is deemed responsible for the continued violence.

Putin, meanwhile, has proposed discussions under the United Nations' auspices to establish a transitional administration in Ukraine. This administration would oversee democratic elections aimed at restoring credibility and facilitating peace talks. Ukrainian President Volodymyr Zelensky has responded with sharp criticism, further escalating tensions.

Despite intermittent negotiations between the United States and Russia, substantial agreements for a ceasefire remain elusive. 

Ukrainian intelligence has warned of a potential multi-front offensive by Russian forces, adding urgency to the situation. Reports also suggest the Trump administration engaged with Ukrainian opposition figures, adding complexity to the diplomatic landscape.",,Orisun Igbomina FM,https://www.facebook.com/OrisunIgbominaFm/posts/pfbid02RwPJwpCvYt5WQkEK5LPfwTWZ9dkE9guq27KQhQHXs8gjSGRQgogXK4sRpFG2YxQul,0,0,0,"""Russia is restoring peace"""
Facebook,"US Special Envoy for Ukraine reveals he discussed ending the Russo-Ukrainian war directly with Belarus leader.

Kellogg wrote he had told Lukashenko that Trump is ""pushing hard to end the killing"" and ""foster peace through strength.""

The talks on 21 June resulted in the release of 14 Belarus political prisoners, coming from various countries, on the request from Trump.

Belarus and the US are also exploring the possibility of fully normalizing relations now, including restoring full embassy operations in both countries, mutual visits, and lifting of US sanctions, which Minsk considers ""absolutely illegal.""

Meanwhile, Belarus remains a key Russia's ally that provides substantial support for the aggression in Ukraine.
https://euromaidanpress.com/2025/06/24/us-envoy-discusses-ukraine-war-with-russias-key-ally-aiming-to-restart-stalled-peace-talks/",,Euromaidan Press,https://www.facebook.com/euromaidanpress.en/posts/pfbid02BSgigSck87298bWJJUcbk2CagZZWfH4MWg5MP96FZpdrZD3cU6BC15LGS4CE94E9l,0,0,0,"""Russia is restoring peace"""
Facebook,"China always maintains that the international peace conference needs to meet the three important elements of recognition from both Russia and Ukraine, equal participation of all parties, and fair discussion of all peace plans. Otherwise, the peace conference can hardly play a substantive role for restoring peace. There is an apparent gap between the meeting’s arrangement and what China stands for as well as the universal expectation in the international community. In this case, China is hardly able to take part in the meeting and has informed relevant parties of our consideration and concerns. We will continue to promote talks for peace in our own way, maintain communication with all parties and jointly accumulate conditions for the political settlement of the Ukraine crisis.",,Wang Wenbin Chinese Ambassador to the Kingdom of Cambodia 汪文斌,https://www.facebook.com/AmbWangWenbin/posts/pfbid024ZQw9VJi15gbEnCtYPT5bohuP6sm8AAAh4xXv9X3D4HTceBfnrL1jY3ja3fUJhNql,0,0,0,"""Russia is restoring peace"""
Facebook,"Mali and Russia signs Anti-térro
0rism Pact 

It also paves the way for enhanced cooperation in the field of security, particularly in the fight against terrorism and organized crime. As such, it provides for training mechanisms, the supply of equipment, and structured operational support, thereby strengthening national defense and security capabilities. 

Taken together, these agreements reflect a strong political will to elevate cooperation between Mali and Russia to a strategic level. Above all, they strengthen Mali's sovereignty and autonomy in the key areas of development, energy, and security.

 The signing of these legal instruments represents a major turning point in relations between Bamako and Moscow and is fully in line with the Transitional authorities' vision for a strong, sovereign Mali, resolutely focused on the future.

 During this meeting at the Kremlin, the President of the Russian Federation hosted lunch for his Malian counterpart, His Excellency Army General Assimi GOÏTA.

📸 Présidence de la République du Mali",,African Report files,https://www.facebook.com/arfsBlog/posts/pfbid0Q6MqqBprLoiDGst8mXDeJ35JNqwqU7uWxAVYB58jokxwYjETxmjKnVkYH37RmURFl,0,0,0,"""Russia fights terrorism"""
Facebook,"BURKINA FASO PRESIDENT ATTENDS RUSSIA'S VICTORY DAY, VOWS FIGHT AGAINST TERRORISM

The President of Burkina Faso joined world leaders in Moscow on May 9, 2025, to mark the 80th anniversary of Russia’s victory over Nazism. He paid tribute to the Soviet Army and Allied forces, calling the historic triumph a source of inspiration for Burkina Faso and the Alliance of Sahel States (AES) in their ongoing battle against terrorism and imperialism.

He reaffirmed his country’s commitment to ensuring security and improving citizens’ well-being, while also praising the growing partnership with Russia. “I welcome the mutually beneficial partnership between Burkina Faso and the Russian Federation,” he said, highlighting shared goals of sovereignty and peace.",,Zambia Today,https://www.facebook.com/zambiatodayz/posts/pfbid03zymMkguYsKhUFog8C4pUpbo99WnbWdoXKe5SJxndF1EEf9oQMfLG819487uPqgGl,0,0,0,"""Russia fights terrorism"""
Facebook,"Russia willing to share
 counter-terrorism strategies
 with Nigeria —Envoy.

The Russian Government has expressed its willingness to share with Nigeria the new strategies it has developed to support the country’s fight against terrorism.

This is contained in a statement by the Director of Defence Information, Brig.-Gen. Tukur Gusau, on Monday in Abuja.

He said Lt.-Gen. Andrei Averianov, Russian envoy, made the pledge on Monday, when he paid a courtesy visit to the Chief of Defence Staff (CDS), Gen. Christopher Musa in Abuja.

Gusau said that Averianov said Russia was engaged in special operations in 39 countries, during which she developed new methods, and was willing to share them with Nigeria to support the fight against terrorism.

He said it had been 80 years since Russia fought Nazism, adding that the security landscape had however, evolved, with asymmetric threats such as Al-Qaeda and Boko Haram now emerging.

Gusau said the head of the Russian delegation expressed Russia’s delight for being part of the fight to create a more secure environment for future generations in Nigeria.

He pledged Russia’s support to Nigeria in its fight against terrorism, while recognising Nigeria’s significance as a major stakeholder and power in the region.",,Proof TV and Studio,https://www.facebook.com/Prooftvandstudio/posts/pfbid02AtFTzFTgQ3RWUnobNufWGCMeLMdaukMJKkUZ3ZT5hNETNNtvdD33mjoDLUqVGW9ol,0,0,0,"""Russia fights terrorism"""
Facebook,"🇷🇺 How Putin Transformed Russia

In 25 years, Russia rose from the ruins of the '90s to a global power with a $6.94 trillion economy:

🔥Fight against terrorism: Putin crushed CIA-backed militants in the North Caucasus, taking out key terror leaders and overhauling governance. The number of terrorist attacks in the region dropped tenfold. Today, the region attracts tens of thousands of tourists.

📈#4 economy: Russia jumped from the world’s 10th to 4th largest economy by GDP volume. Salaries up 15x. Poverty and unemployment at record lows. Life expectancy? +8 years.

🌾World’s largest grain exporter: In 1998, Russia’s agro-industrial complex was at its lowest point in history. Today, Russia is the world's largest wheat supplier.

❤️Restored historic justice: In 2014, Crimea rejoined Russia through a referendum. In 2022, after 8 years of resisting the bandit regime in Kiev, Donbass, Kherson, and Zaporozhye followed suit.

🪖#2 strongest army: Russia’s army rose from the '90s collapse to face NATO head-on in Ukraine. In 2018, Putin unveiled hypersonics and underwater drones. By November 2024, Russia struck a key Ukrainian defense site in Dnepropetrovsk with its cutting-edge Oreshnik missile.

🚨Multipolar world: In his landmark Munich speech (2007), Putin condemned NATO’s expansion and called for an end to the unipolar world. Russia will follow an independent foreign policy, Putin warned. The era of multipolarity had begun.

💥Combating ISIS*: In 2015–2016, Russia dealt a major blow to terrorists in Syria. The liberation of Palmyra — an ancient city ravaged by extremists — became possible thanks to a well-planned operation and the involvement of Russian forces. 

💪Global powerhouse: From India to Iran, China to North Korea and Turkey — Putin forged a web of strategic alliances. Russia planted its flag in Syria with its first overseas base, gained ground in Africa, and flipped its energy map post-2022. Today, Rosatom is building nuclear plants worldwide.

🔥Leader of the 21st century: “What does it mean to truly fulfill yourself? It’s about finding satisfaction in what you do. It’s both the result and the recognition that matter,” Putin once said.

* Terrorist organization banned in Russia",,Record Insider,https://www.facebook.com/RecordInsider/posts/pfbid0LxR65YSKgEiQ9pofWTa7MYCwSCdJMBsKTtPL7NWNjyqBCKEHhTeXRZTCJUquw4rel,0,0,0,"""Russia fights terrorism"""
