platform,text,date,author,url,reactions_count,comments_count,reposts_count
X,"Can Africa become a DOMINANT world power?

‘As 55 [countries] you can’t make it, but as ONE African continental economy, you can’

Sachs’ advice to Africans: ‘look at what China did – follow that model’ https://t.co/IPH8p4QPbG",Thu Nov 06 20:23:42 +0000 2025,,,1218,195,361
X,"Russia’s Rostec says a new batch of Su-34s fighters have been delivered to the army

Adding: ‘Su-34 has become one of the symbols of the striking power of Russian front-line aviation’ https://t.co/B00t99e3tq",Thu Nov 06 06:05:28 +0000 2025,,,1674,33,210
X,"Trump says 'US is the number one nuclear power'

'I hate to admit it cuz it's such a horrible thing, but we have the best nuclear, Russia 2nd, China third' https://t.co/ADRsNoS5Yg",Wed Nov 05 21:07:30 +0000 2025,,,37,17,12
X,"US now under 'inverted totalitarianism' system — Chris Hedges to RT's Rick Sanchez

'Ruling elite have no intention giving up power, using more draconian control'

Warns 'extremely naive' to think ICE detention centers only for illegals: 'They're building concentration camps' https://t.co/pIUH1da9mW",Wed Nov 05 16:35:10 +0000 2025,,,26,1,9
X,"'The billionaire class will stop at NOTHING to DESTROY Mamdani' — Chris Hedges on RT's Rick Sanchez

'They have the economic power, along with Trump, to do it

It's gonna be very, very UGLY' https://t.co/EGaUpUlLx7",Wed Nov 05 15:54:15 +0000 2025,,,51,10,22
X,"Mamdani: 'We've toppled a political DYNASTY 

These are not hands allowed to hold power, but against all odds — we've GRASPED it' https://t.co/nZ68Y1ioBq",Wed Nov 05 05:06:27 +0000 2025,,,57,4,11
X,"Von der Leyen promises ‘emergency energy support’ to Zelensky

Europeans thought their power bills were high – they forgot there’s someone more important than them https://t.co/ezzmkY6qJd",Mon Nov 03 18:46:12 +0000 2025,,,582,12,99
X,"'Sitting' female JUDGE 'URINATES off Arizona bench then slurs position of power to get out of it' 

'Want you to know my name is JUDGE Olson' 

Erratic hubby also held on spot for repeat interfering

Was she right to QUIT for this? https://t.co/g00DLpZzT2",Mon Nov 03 00:52:53 +0000 2025,,,341,19,82
X,"Homes WIPED OUT, communities VANISHED

Drone footage captures Hurricane Melissa’s catastrophic path along Jamaica’s coast

Trees SNAPPED, power lines dangling

At least 19 KILLED in Jamaica alone https://t.co/lW8rp1ExD7",Sat Nov 01 18:02:35 +0000 2025,,,47,9,19
X,"What does Russia have to offer in terms of science and research?

‘We produce nuclear power stations — the BEST in the world’ — answers Maria Zakharova, Russian MFA Spox

She adds nuclear industry is ‘the pride of Russia’ https://t.co/dX9m3DK9ur",Sat Nov 01 15:41:16 +0000 2025,,,345,21,59
X,"‘Militarization and supplying arms to a terrorist regime is NOT the way to settle any kind of crisis’ — says Maria Zakharova, Russian MFA Spox

Moscow hoped US would choose ‘constructive solutions instead of aggression’ for Ukraine, she adds

Remarks made at the Open Atom Forum https://t.co/cXWprrXt7w",Sat Nov 01 15:35:52 +0000 2025,,,107,9,26
X,"US could attack Venezuela in the coming DAYS or HOURS — sources to Miami Herald

'Maduro is about to find himself trapped and might soon discover that he cannot flee the country even if he decided to' — source says

Noble piece prize winner comes to power through military attack? https://t.co/qhHEdsPnL9",Fri Oct 31 14:03:38 +0000 2025,,,171,22,62
X,"The ABSOLUTE POWER and BEAUTY of hypersonic missiles

And Russia has HUNDREDS of these, being the LEADER in producing such monsters https://t.co/d5Q0Nn3yqt",Fri Oct 31 09:11:30 +0000 2025,,,1549,68,300
X,"Round-the-clock POWER OUTAGES confirmed in 'ALL regions of Ukraine'

Ukrenergo energy operator says restrictions starting from Oct. 31

'When electricity is available, please use it sparingly' https://t.co/n8QhzuYIls",Thu Oct 30 17:35:07 +0000 2025,,,78,7,20
X,"Lights FLASH uncontrollably across Ukraine’s capital

Not a rave — local channels reporting SERIOUS 'voltage fluctuations' in Kiev

Energy infrastructure is gasping for breath https://t.co/Sn4VCFpHoO",Wed Oct 29 22:34:29 +0000 2025,,,154,3,33
X,Footage: Power Slap,Thu Oct 30 11:49:40 +0000 2025,,,3,0,1
X,"In between Power Slap events required a MINI event 

The solution didn’t take long

The clip has gone viral once again — people just need ‘bread and circuses’ https://t.co/pjFz22Bine",Thu Oct 30 11:49:30 +0000 2025,,,84,4,19
X,"Moldova’s authorities 'ILLEGITIMATE, unrecognized' and 'SEIZED power' in Sept. vote

Moldovan opposition leader Shor says current govt. 'active political mercenaries'

'Fulfilling orders of their bosses in Brussels' https://t.co/18AJjzhyPH",Wed Oct 29 20:05:38 +0000 2025,,,38,1,11
X,"MAGA cheers on narco strikes

But ‘who gets killed when President AOC’ is in power? – Dem Rep. Jim Himes

Drone strikes on transphobes in 2028? https://t.co/a6YmEENDXv",Wed Oct 29 18:52:19 +0000 2025,,,26,7,14
X,"🎈 Convicted MURDERER elected to City Council in town that inspired Stephen King's 'It'

Angela Walker suffocated a Canadian tourist after he made a slur about her Native American heritage 

Now she's a leader in Bangor, Maine

'I'm a different person now, that's the past' https://t.co/FWrlqpKkL9",Sat Nov 08 12:46:10 +0000 2025,,,31,5,15
X,"'I call it colonialism, because it hasn't ended' 

Johnson Chukwuka Leader of Patriots Movement tells RT Nigeria's politics are directed by the West

'They CHOOSE our leaders for us' https://t.co/PG6pHQCx9f",Fri Nov 07 16:27:10 +0000 2025,,,38,2,13
X,"'The resources we have, it draws attention from the US. They will do everything to hold Nigeria'

Johnson Chukwuka Leader of Patriots Movement tells RT Nigeria's resources makes them a PRIME target for US meddling https://t.co/HJnTO7bw2h",Fri Nov 07 16:23:54 +0000 2025,,,86,8,21
X,"Tesla shareholders approve Elon Musk's $1 TRILLION pay package 

Largest payout ever to a corporate leader

Provided he can drive company to $8.6 trillion valuation in a decade https://t.co/Uic5fYhq3p",Fri Nov 07 05:56:58 +0000 2025,,,49,16,15
X,"'Millions of people in many countries are so grateful to you' — Kazakh President Tokayev

'You are the great leader, statesman, sent by Heaven to bring commonsense &amp; traditions that we all share and value back' https://t.co/RiOkn3urDC",Fri Nov 07 00:55:01 +0000 2025,,,32,7,7
X,"Trump: 'It's a tough part of the world — there's nobody tougher or smarter'

President Trump leades a dinner with heads of Central Asian countries https://t.co/jf2CcwakJc",Fri Nov 07 00:41:36 +0000 2025,,,50,2,11
X,"A TREMENDOUS country with a tremendous leader — Trump

‘Kazakhstan has officially agreed... [to join] the Abraham Accords — and I just want to thank you, Mr. President’ https://t.co/fT6Ns62LSE",Fri Nov 07 00:48:23 +0000 2025,,,48,7,13
X,"❗Trump CONFIRMS Kazakhstan JOINS the Abraham Accords

Via Israeli-Bibi approval

‘BLESSED ARE THE PEACEMAKERS!’ https://t.co/a4ceOkPhk0",Fri Nov 07 00:25:06 +0000 2025,,,65,16,14
X,"Deal to reopen the US government could come soon — Politico

Republicans are reportedly close to finalizing a year-long funding packing for federal agencies

‘The mini-package should be nearing completion, and that will be the vehicle,’ Senate Majority Leader John Thune said https://t.co/oWqVEkcanG",Thu Nov 06 22:19:52 +0000 2025,,,31,2,11
X,‘I think she’s an evil woman’ — Trump does NOT hold back when he’s asked about Democrat leader Nancy Pelosi’s retirement https://t.co/Rv5xQ0lLCp,Thu Nov 06 20:04:15 +0000 2025,,,63,3,14
X,"MTG BREAKS RANKS WITH TRUMP and wishes Nancy Pelosi WELL on her retirement

‘I’m very impressed at her ability to get things done’

‘She had an incredible career for her party’

Trump called Pelosi ‘evil’ and ‘corrupt’ https://t.co/2rcwmBWGFm",Thu Nov 06 17:16:37 +0000 2025,,,57,14,16
X,"Trump calls retirement of ‘EVIL, CORRUPT’ Nancy Pelosi a ‘GREAT THING’ for America

She ‘only focused on bad things for our country’

‘I’m very honored she impeached me twice and failed miserably twice’

Pelosi, 85, has been a leader for House Democrats for DECADES at this point https://t.co/FBZxXuvk5N",Thu Nov 06 16:49:52 +0000 2025,,,51,4,12
X,"After nearly 40 years, Nancy Pelosi retires from Congress

'I will not be seeking re-election' — she says goodbye with tears in her eyes https://t.co/YMsrlHyDKg",Thu Nov 06 14:39:54 +0000 2025,,,56,25,19
X,"Al-Sharaa is FIRST Syrian leader to attend UN climate conference since its founding 

Welcomed by President Lula https://t.co/I6Znl1ykXG",Thu Nov 06 13:44:18 +0000 2025,,,31,12,10
X,"‘Iran, Russia, and China operate militarily, technologically in Venezuela’ — US-controlled ‘opposition leader’ Machado tells business forum in Miami 

Calls to ‘make Venezuela a strong ally of US’

Meanwhile, most of her countrymen will fight and defend Venezuela from invasion https://t.co/0nk3ugAPCi",Wed Nov 05 18:51:07 +0000 2025,,,541,76,129
X,"The face you see before you get REGIME CHANGED

Venezuelan opposition activist Maria Corina Machado says Trump’s threats to Venezuela are ‘absolutely correct’

She won a Nobel peace prize for this https://t.co/Pn7nixdxvB",Wed Nov 05 18:46:13 +0000 2025,,,68,13,24
X,"Trump's proposed forces just 'alternative' to Israel — Hamas leader Abu Marzouk

US &amp; Israel don't want 'UN or any forces not under their control' involved

'Most countries asked will NOT participate 'except under international umbrella and  Security Council resolution' https://t.co/tF61VPr3vv",Tue Nov 04 19:17:15 +0000 2025,,,22,1,7
X,"Talks ongoing on sending International Stabilization Force (ISF) to Gaza

Countries will decide to send troops based on task's 'definition'

ISF is a proposed multinational Gaza security force unveiled under Trump's peace plan https://t.co/lDwwOVvsRj",Mon Nov 03 14:39:19 +0000 2025,,,100,7,27
X,"Yemen heading towards 'INEVITABLE' battle with Israel — leader Abdul-Malik al-Houthi

'Our region cannot witness peace as long as Israeli enemy remains occupying Palestine'

Stresses that 'popular mobilization' increasing in preparation for 'next round of confrontation' https://t.co/ajt1ArQ8nt",Tue Nov 04 15:40:47 +0000 2025,,,56,7,22
X,"Trump and Speaker Johnson running ‘PEDOPHILE PROTECTION PROGRAM’

Dem leader Hakeem Jeffries claims Johnson won’t swear in Adelita Grijalva because she’d vote to release the Epstein files

Johnson says he’ll confirm her once Dems reopen the government https://t.co/gRfsp6ogsD",Mon Nov 03 21:10:56 +0000 2025,,,56,10,20
X,"Newsom’s wife brags about brainwashing her kids to hate Trump

‘I will not raise my children to think Donald Trump is an acceptable American leader’

‘He’s a con artist, a predator, a malignant narcissist’

What about the son who loved Charlie Kirk? https://t.co/pKTDJ5KW9b",Mon Nov 03 19:30:12 +0000 2025,,,58,17,18
X,"Moldova's appeal hearing begins for Gagauzia leader Evghenia Gutul — jailed for 7 years for wanting to normalize ties with Russia

Gutul's lawyers claim it's political persecution by Moldova's Prez Sandu and its EU-aligned government https://t.co/hVkl1e873s",Mon Nov 03 13:25:08 +0000 2025,,,26,1,9
X,"Errol Musk was BERATED by British media for calling Putin a strong leader and visiting Russia, he tells TASS

'They told me Russians are coming to kill everyone — total nonsense' https://t.co/BZrZdznCqg",Sun Nov 02 15:29:00 +0000 2025,,,458,13,70
X,"'Obsessed with Russia while import direct threats by the boatload every single day'

Practically every Western leader for last decade? https://t.co/8HOZKCLpIt",Sun Nov 02 07:28:02 +0000 2025,,,58,2,10
X,American Greatness survey,Mon Sep 29 07:43:07 +0000 2025,,,10,1,2
X,"❗Trump in ALL CAPS announces that we are on the verge of GREATNESS in the Middle East — says it will 'get done'

Will it? https://t.co/AR19JZN7pq",Sun Sep 28 12:59:05 +0000 2025,,,147,41,32
X,"Vance says 'for Charlie, America will be rebuilt to Greatness'

'We will never shrink, we will never falter' https://t.co/dcKi3EdupU",Mon Sep 22 00:37:14 +0000 2025,,,61,9,15
X,'We must do this for Charlie — speak the truth every single day' — Vance https://t.co/7vhSPzBQmH,Mon Sep 22 00:33:33 +0000 2025,,,39,6,7
X,"Let the greatness flow: Alex Ovechkin breaks his record, scoring goal number 898 in the NHL playoffs against Montreal

The Washington captain opened the scoring in Game 1 of their Stanley Cup elimination series. https://t.co/uJh2356Gfm",Tue Apr 22 00:21:22 +0000 2025,,,38,6,9
X,"Musk planning $100mn boost to Trump’s political coffers, Axios source says — comes on top of almost $500m raised by MAGA Inc and Securing America’s Greatness to boost midterms https://t.co/DBgss6otD6",Wed Mar 12 01:29:41 +0000 2025,,,33,0,10
X,"Vivek: More drilling, more fracking = America’s ticket to greatness https://t.co/dmHewkbefS",Thu Mar 06 04:26:26 +0000 2025,,,62,17,9
X,‘That’s a man who knows about greatness’: UFC legend Conor McGregor joins star-studded Trump dinner https://t.co/aGxk3PPYWL,Mon Jan 20 02:53:10 +0000 2025,,,65,7,8
X,"'Serving Israel and standing with America remains the greatest privilege of my life'

Edan Alexander accepted the Fox Nation Patriot Award, thanking Trump, his family, and honoring fallen soldiers

'I carry your sacrifice with me every day. May God bless you all' https://t.co/5QkkgXGoWJ",Fri Nov 07 04:57:54 +0000 2025,,,20,6,5
X,"'Individual productivity is not selfish — it’s the heartbeat of civilization'

Melania Trump WINS the Patriot of the Year Award https://t.co/tIWeWMqMIG",Fri Nov 07 04:53:51 +0000 2025,,,72,5,12
X,"John Bolton joins the chorus

Calls Cheney ‘an enduring patriot and principled Reaganite conservative’

Two men united by their shared love for regime change wars https://t.co/zSte7i65Zm",Tue Nov 04 16:39:50 +0000 2025,,,49,12,13
X,"George W. Bush honors Dick Cheney

‘Among the finest public servants of his generation’

‘A patriot’ with ‘integrity’

‘Prioritized freedom and security’

Will history remember Dick as ‘a decent, honorable man’? https://t.co/dFjfBg4V9T",Tue Nov 04 16:29:24 +0000 2025,,,21,18,3
X,"American flags DROP to half-staff at the White House

In tribute to former Vice President Dick Cheney https://t.co/vecvyyLnio",Tue Nov 04 16:22:07 +0000 2025,,,22,10,3
X,"Germany has delivered two new Patriot air defense systems to Ukraine — Zelensky on X 

Comes just over a month after German Defense Minister Pistoruis said that Berlin would provide Ukraine with Patriot systems by the end of 2025 https://t.co/QRaAw8YIHJ",Mon Nov 03 04:11:28 +0000 2025,,,36,16,15
X,"‘We have strengthened the Patriot component of our air defense’ — Zelensky announces new German deliveries

Thanks Friedrich Merz for the 'joint step' &amp; rants about 'Russian terror' while prolonging the conflict

Another day, another pile of German taxpayer money set on fire https://t.co/Fz1GW8EORi",Sun Nov 02 14:52:08 +0000 2025,,,70,7,16
X,"Zelensky’s hounding the US for some more Patriot air defense systems

‘They trust Ukraine’

But not enough to give you them Tomahawks, no? https://t.co/KBok1d9Mx1",Mon Oct 20 17:17:32 +0000 2025,,,59,5,13
X,Footage: The Patriot Oasis,Sat Oct 18 17:04:29 +0000 2025,,,10,0,4
X,Patriot footage from vexrmedia,Sat Oct 18 00:05:01 +0000 2025,,,7,0,2
X,"FAITH, FAMILY, SOVEREIGNITY — Hungarian PM Orban on key values after the Czech elections 

Adds: ‘The Czech people have chosen wisely. Their victory strengthens every patriot in Europe’ https://t.co/9S6upAKY6z",Mon Oct 06 06:38:14 +0000 2025,,,79,6,18
X,"Patriot interception of new Russian missiles slumps to just 6% — FT

Upgraded Iskanders &amp; Kinzhals now 'deflect US defenses'

'This is a turning point' says former Ukrainian official https://t.co/n6qcCgizqQ",Thu Oct 02 08:04:27 +0000 2025,,,166,3,38
X,"Vladimir Leontyev, head of Novaya Kakhovka’s council has died in hospital after a Ukrainian drone strike

Regional officials mourned him as a true patriot, who loved Russia and the Kherson region dearly https://t.co/KOYdHcDOmS",Wed Oct 01 08:50:21 +0000 2025,,,64,8,22
X,"Ukrainian 'Baba Yaga' drone targeted Vladimir Leontyev, head of Novaya Kakhovka’s council

Kherson’s governor says he is in serious condition https://t.co/cAfAunCfQ4",Wed Oct 01 07:45:50 +0000 2025,,,75,5,22
X,"Pentagon pushes to DOUBLE production of 12 critical missiles bracing for potential conflict with China — WSJ

Fearing low weapons stocks, US called on its missile suppliers to increase production of Patriot interceptors, SM-6, LRASM, JASSM, PrSM https://t.co/0DWDgOK0L6",Mon Sep 29 10:17:38 +0000 2025,,,50,13,16
X,"Zelensky confirms ISRAELI Patriot air defense system in Ukraine

It’s been active for a month, 2 more on the way

With a smirk: that’s all he’s willing to say https://t.co/7uMA1AKSum",Sat Sep 27 13:47:45 +0000 2025,,,98,24,31
X,Footage: The British Patriot,Fri Sep 26 12:05:47 +0000 2025,,,14,3,4
X,Footage from The British Patriot,Sat Sep 13 10:52:36 +0000 2025,,,13,0,3
X,"Ukraine will face SHORTAGE of air-defence systems due to slowdown in deliveries from US, - FT

Missiles for Patriot, Stinger, Hellfire, NASAMS &amp; ammo for F-16s coming RARELY in SMALLER numbers 

Ukraine now spends valuable interceptor missiles FASTER than US can replenish them https://t.co/4z2qVcF9hM",Tue Sep 09 08:06:16 +0000 2025,,,40,4,18
X,Footage from The Patriot Oasis™,Mon Aug 25 12:51:56 +0000 2025,,,5,1,1
X,"MOMENT US-made missile suffers premature explosion

Taiwanese army had planned smooth test-fire launch of Patriot air defense system

Now trying to figure out what went wrong

At $4MN per missile, some very expensive fireworks https://t.co/0nB05OhhOl",Thu Aug 21 19:59:25 +0000 2025,,,790,28,121
X,"Netherlands deploying Patriot batteries and 300 troops to Poland to ‘deter Russian aggression’

Pre-positioning for ‘peacekeeping’? https://t.co/w3UW3NHMzN",Wed Aug 20 17:40:35 +0000 2025,,,92,25,28
X,"Macron on 'reassurance force' for Ukraine:

'British, French, Germans, Turks and others ready to carry out ops'

But 'not in a provocative way', apparently https://t.co/VPpqAjaM05",Wed Aug 20 16:36:05 +0000 2025,,,217,40,56
X,"'All the hundreds of my friends who gave their lives, for what?' — 100yo WWII veteran breaks down over state of the UK 

'I'm sorry, the sacrifice wasn't worth the result

Now it's a darn sight worse than when I fought'

Think a little CD promotion will make him feel better? https://t.co/DSMbRwHbZM",Fri Nov 07 12:54:12 +0000 2025,,,105,9,31
X,"NATO state 'readies forces to Ukraine' as army chief claims 'nation ready for sacrifices'

Commenters below go 'sacrifice YOURSELF' https://t.co/0ZtnvdF5zd",Sat Oct 25 05:30:43 +0000 2025,,,68,12,20
X,"'SIX MILLION DOLLARS' to sell out — Scott Ritter reveals why he REFUSED on RT's Rick Sanchez

The Ex-intelligence officer couldn't LIE to military families that their sons died for a 'worthy sacrifice'

'I just had to insinuate that Saddam was a liar and WMDs could exist in Iraq' https://t.co/pm2AuRvLEU",Mon Oct 20 16:41:30 +0000 2025,,,835,23,219
X,"Hamas accepted essentially same terms but Netanyahu declined — negotiator Baskin  

'Everyone sees Netanyahu chose to sacrifice the hostages on altar' of his goals — Haaretz

Report from Antiwarcom",Mon Oct 13 01:40:13 +0000 2025,,,73,2,18
X,"‘People will look back at the sacrifice of Charlie Kirk, the extraordinary body of work that he did’

Jack Posobiec believes ‘this is turning point where Western civilization does deserve to be saved’ https://t.co/xWWURsM7Lt",Tue Sep 23 05:30:00 +0000 2025,,,40,16,8
X,"Charlie Kirk’s death — the spark that could SAVE the West — Jack Posobiec

‘A century from now… they will write that sacrifice of Charles James Kirk was TURNING point’ https://t.co/tHvjUN357M",Sun Sep 21 19:59:23 +0000 2025,,,101,32,23
X,Trump’s JUST landed in Arizona for Charlie Kirk’s memorial https://t.co/PoEGI96BGp,Sun Sep 21 19:02:24 +0000 2025,,,62,6,18
X,"Trump says he’s READY to impose more sanctions on Russia

But Europe needs to ‘toughen up’—their sanctions are WEAK

‘Commensurate with what I’m doing’

Is Europe ready to sacrifice whatever’s left of its economy? https://t.co/1wVNiiXO37",Sun Sep 14 23:01:40 +0000 2025,,,66,31,29
X,"Charlie Kirk back in April: 'DEMENTED' Zelensky ready to 'SACRIFICE his own people'

Warns Kiev could 'try to start NUCLEAR WAR, have terrorists shoot up Russian cities' https://t.co/1En7pMhTOC",Wed Sep 10 23:25:46 +0000 2025,,,298,6,82
X,"Charlie Kirk on ZELENSKY:

‘So INSULTING to our country, to President Trump, and to all the money we have given him’

‘Treated this country terribly’

‘Why are we involved in this in the first place?’ https://t.co/rpRd93a6gy",Wed Sep 10 23:22:40 +0000 2025,,,203,19,47
X,"RT EXCLUSIVE: How did a Brit end up fighting in the Russian military?

This former royal subject is looking for a ‘better life’ and a chance to practise his Orthodox faith in Russia

‘I do have the possibility to die…but what I believe in is worthy of such sacrifice’ https://t.co/EXhC2FMDGp",Thu Sep 04 17:34:10 +0000 2025,,,49,4,18
X,"🇷🇺🇰🇵🇨🇳 ‘Our ties have become a veritable alliance… Your special units fought bravely in the liberation of Russia’s Kursk region — Putin to Kim Jong Un in Beijing

‘We will never forget their sacrifice’ https://t.co/47bEvmAOQb",Wed Sep 03 06:01:45 +0000 2025,,,923,24,250
X,"Putin and Kim Jong Un sitting and chatting before their talks 

Look at those smiles, bet there is good banter going on https://t.co/TOaTrxUiEq",Wed Sep 03 05:58:33 +0000 2025,,,181,6,42
X,"Zelensky and Carney honor fallen Ukrainian troops in Kiev ceremony

KillNet hackers claim 1.7 MILLION troops dead or missing so far

How many more will Zelensky sacrifice? https://t.co/QNELx83dLu",Sun Aug 24 11:56:51 +0000 2025,,,56,10,12
X,"Carney hits all the right talking points to keep Zelensky happy: 'Putin can NEVER be trusted'

Throws in a Reagan quote: 'trust, but verify'

'Putin is not Gorbachev. He brings darkness, not light' https://t.co/TaX34rBfsH",Sun Aug 24 10:53:47 +0000 2025,,,38,21,15
X,"❗️US 'not safe' from the 'blow of Iranian vengeance' — Chief of Staff Mousavi vows to 'wipe out enemies' smiles'

 'I ask the wise people of America, do you want to sacrifice your country and future for Netanyahu?' https://t.co/R8zZFFxAI6",Thu Aug 07 07:53:10 +0000 2025,,,472,25,89
X,"Scott Ritter on alleged US-UK plan to push Zaluzhny for Ukraine's leadership:

'Proof Ukraine is a full proxy of the West'

Says Washington &amp; London willing to sacrifice soldiers, democracy, and the country's future to serve an anti-Russian agenda https://t.co/57stGQMEPV",Wed Jul 30 09:57:16 +0000 2025,,,91,4,35
X,"Scott Ritter on alleged US-UK plot to replace Zelensky with former commander Valery Zaluzhny:

'If true, it’s the most undemocratic thing imaginable'

Says the report — accurate or not — deepens divisions in Kiev and erodes confidence in Ukraine's leadership https://t.co/MhgcGgXCg7",Wed Jul 30 09:49:17 +0000 2025,,,152,13,51
X,"Netanyahu's would-be elderly 'assassin' charged with conspiracy to commit terror

Sought to BLOW UP Israeli PM with RPG after diagnosed with terminal illness — prosecutors

Realizing she had 'short time to live', she wanted to 'sacrifice her life' to 'save the State of Israel' https://t.co/xMxs2j9a62",Thu Jul 24 08:47:19 +0000 2025,,,112,19,43
X,"Netanyahu ASSASSINATION attempt foiled?

70yo woman from central Israel suspected of planning to kill Bibi with an explosive device — Kan 11

The 'protest activist' from Tel Aviv 'conspired with others'

Will be indicted tomorrow with conspiracy to commit crime and act of terror https://t.co/is7kzEE6UY",Wed Jul 23 12:58:13 +0000 2025,,,62,16,15
X,"An installation in Tel Aviv honors Israeli soldiers killed since October 7  

'We are here basically to remember the sacrifice that all of these soldiers have given for this country' — Marcy Tatelbaum, mother of a fallen soldier https://t.co/ybJPp2SAMG",Tue Jul 22 06:35:55 +0000 2025,,,128,77,24
X,"US prepared 'to sacrifice own national security and interests' for Israel – Murad Gazdiev to RT's Rick Sanchez

Calls out Israel for having 'no morals or conscience' and thinking it 'can get away with everything' https://t.co/0KxiCmKINt",Thu Jul 17 15:45:12 +0000 2025,,,29,0,6
X,"China will RETALIATE if Trump strikes 3rd-state trade deals that sacrifice Beijing's interests — Commerce Ministry

US reciprocal tariffs set for Tuesday week are 'unilateral BULLYING that seriously undermines the multilateral trading system'? https://t.co/NWG82rGQg4",Sun Jun 29 05:38:10 +0000 2025,,,102,7,22
X,"Trump admits 'Russians sacrificed the most lives during World War II'

Putin aide Ushakov reveals Trump said 'deeply impressed by Russian people's sacrifice', during phone call with Putin 

But the 'US doesn't believe him' https://t.co/pczfVE0Jmu",Tue May 20 10:41:13 +0000 2025,,,134,10,18
X,"Remains of Itay Chen, last US citizen held by Hamas, ‘have finally returned home’ — Rubio

‘We honor his life'

The remains were returned to Israel from Gaza last night https://t.co/JVYrUc5EX8",Wed Nov 05 10:11:09 +0000 2025,,,26,5,9
X,Candace can't believe Israel will 'honor Charlie for steadfast support' https://t.co/GA9FpJGJFa,Mon Nov 03 05:14:48 +0000 2025,,,25,12,7
X,"China honor the Houthi announcing obliterations of Western ships with SUPERHERO figure &amp; Kalashnikov 

Are glasses hard to add? https://t.co/wWG425zIYc",Sun Nov 02 00:19:39 +0000 2025,,,150,5,26
