platform,text,date,author,url,reactions_count,comments_count,reposts_count
X,"First grand white wedding in Notre-Dame since the fire: the couple: Martin &amp; Jade Lorentz 

In a historic twist, Martin isn't an emperor—he's the carpenter who spent 3 years restoring the cathedral's woodwork 

A rare honor for the man who helped rebuild it https://t.co/soQfkkwvgc",Sat Nov 01 14:47:12 +0000 2025,,,125,9,26
X,"Trump says it will BE HIS HONOR to fund SNAP

But the government still does not believe it has the legal authority to continue to fund SNAP, despite court rulings

Trump urged people to call Schumer’s office to end the shutdown https://t.co/9A3VdUa4lO",Fri Oct 31 22:18:08 +0000 2025,,,74,8,29
X,"Federal judge ORDERS SNAP benefits continue

A federal judge ruled the food assistance benefits must be paid through an emergency fund

About 41.7 million people rely on SNAP

Meltdowns at grocery stores averted… for now? https://t.co/NkeSbczZ1g",Fri Oct 31 18:49:52 +0000 2025,,,55,13,21
X,Star-Spangled Banner plays in honor of the Don at the Akasaka Palace in Tokyo,Tue Oct 28 01:19:25 +0000 2025,,,20,0,4
X,"At least Keir Starmer's Turkish is better than his policies

Merhaba Asker (Hello soldiers) — he greets guard of honor upon arrival in Turkey

Although Erdogan doesn't look impressed https://t.co/fMx5RhVPyc",Mon Oct 27 15:15:32 +0000 2025,,,172,8,19
X,"Trump hosts Qatar’s Emir aboard Air Force One

While plane is refueling

‘Honor to have you on the plane’ https://t.co/OF5A8E1H9R",Sat Oct 25 17:40:18 +0000 2025,,,210,13,27
X,Adm. Alvin Holsey says 'honor to serve our nation' as he announces he's stepping down https://t.co/GoKA0xIfMX,Thu Oct 16 20:18:35 +0000 2025,,,16,4,8
X,"Roscosmos cosmonauts lovingly describe Earth’s and her landscapes from onboard ISS, in honor of the White Cane Day, dedicated to the blind and visually impaired

A world-first experiment turning space imagery into words — ‘bringing the space closer for everyone’ https://t.co/2AMjaBl83p",Thu Oct 16 13:28:11 +0000 2025,,,62,6,10
X,"Al-Sharaa's promise to honor past deals suggest Moscow's two main military bases in Syria are safe — Reuters

Syria also seeks:

▪️Guarantees to NOT rearm remnants of Assad's forces
▪️Help in rebuilding Syrian army
▪️Handover of Assad to face trial https://t.co/e8atso4NpC",Wed Oct 15 16:13:23 +0000 2025,,,238,40,42
X,"Deputy PM Novak sums up Russia-Syria talks:

▪️Russia can provide energy and transportation support

▪️Russia ready to help develop oil fields in Syria

▪️Will convene intergovernmental commission to further trade and economic co-op https://t.co/bAZdfkZLTl",Wed Oct 15 14:47:05 +0000 2025,,,76,20,23
X,"Russian Governor ERUPTS, FIRES official on the SPOT over ruined WW2 memorial

‘Is this JUST a stone?’ — Samara’s Head Fedorishchev 

‘Yes’

‘You’re FIRED… f*ck off’

NEW memorial to honor WW2 heroes will now be built https://t.co/7nJeexyVew",Tue Oct 14 20:41:48 +0000 2025,,,824,22,107
X,"Plaster reliefs on the station’s walls honor Iran’s 350,000-strong Christian population https://t.co/8tArefN8LX",Mon Oct 13 22:07:57 +0000 2025,,,221,2,27
X,"Trump arrives at Knesset, signs guest book before address

'This is my great honor — A great and beautiful day, A new beginning' https://t.co/CN3ncRNkd0",Mon Oct 13 08:27:32 +0000 2025,,,62,6,15
X,"Trump says Nobel Peace Prize winner María Corina Machado personally CALLED

‘I’m accepting this in HONOR of you,’ she told him

He quips ‘I didn’t say give it to ME… she might have’

‘They need a lot of HELP in Venezuela’ https://t.co/PBSD3P7tZ9",Fri Oct 10 22:28:39 +0000 2025,,,172,38,29
X,"Hamas says Gaza deal WON’T work without Trump

Agreement ‘wouldn’t be POSSIBLE’ without 47

Trump must ‘PRESSURE’ Netanyahu to honor commitments https://t.co/ZK7v9T7hCk",Fri Oct 10 18:48:38 +0000 2025,,,71,4,18
X,"French opposition politician Marine Le Pen CONGRATULATES Venezuelan opposition figure Maria Machado for Nobel VICTORY 

She sees it as an 'honor' for the struggle of women for freedom, democracy and pluralism https://t.co/LExRogYWVM",Fri Oct 10 18:13:34 +0000 2025,,,37,10,11
X,"'This is TYRANNY. This is outrageous'

Schumer responds to Letitia James’ indictment

Says honor of Justice Dept. has been 'twisted inside out' https://t.co/RYYQCmUuHr",Thu Oct 09 21:59:29 +0000 2025,,,37,13,11
X,"2023: Letitia James sows

2025: Letitia James reaps

‘No one is above the law’ indeed https://t.co/TQttpmhVo2",Thu Oct 09 21:04:49 +0000 2025,,,68,3,15
X,"'It's been a personal HONOR seeing you lead'

SecWar Hegseth COMMENDS Trump on 'historic' leadership   

'Those who lived through years of war and foolish policy, could never have believed this peace was possible' https://t.co/LfvVzDYdDN",Thu Oct 09 18:11:35 +0000 2025,,,33,4,10
X,"RFK Jr. tells Trump 2 studies show circumcised kids have 'DOUBLE the rate of autism'

'Highly likely because they’re given Tylenol'

Does add a disclaimer: 'none of this is positive' https://t.co/Sn9Xj8N1IZ",Thu Oct 09 18:08:15 +0000 2025,,,33,7,14
